A1: fb_8x230V input specs:
A2: tested Value per channel:
A3: input current at 235V: | C3: 3,8mAac
A4: U cap at 235V | C4: 233Vac
A5: U resist at 235V | C5: 11Vac
A6: calculated cos phi | C6: 00.05
A7: power RMS at 235V | C7: 44,65mW
A8: circuit stressed by | C8: 260Vac
A9: stressed with phaseshifting by connecting at Umax
A10: up to 260Vac RMS, also | C10: 370V
A14: see following value to tune the input trigger:
A17: R-pullup kOhm | B17: U Vac high | C17: U Vac low | D17: Leitwert pullup1/OHM
A18: 2.2 | B18: >260 | C18: not tested | D18: =1000/A18 -> 454.5454545454545
A19: 2.7 | B19: 246 | C19: 217 | D19: =1000/A19 -> 370.37037037037032
A20: 3.3 | B20: 217 | C20: 194 | D20: =1000/A20 -> 303.03030303030306
A21: 3.9 | B21: 194 | C21: 174 | D21: =1000/A21 -> 256.41025641025641
A22: 4.7 | B22: 175 | C22: 158 | D22: =1000/A22 -> 212.7659574468085
A23: 5.6 | B23: 156 | C23: 142 | D23: =1000/A23 -> 178.57142857142858
A24: 6.8 | B24: 138 | C24: 127 | D24: =1000/A24 -> 147.05882352941177
A25: 8.2 | B25: 126 | C25: 116 | D25: =1000/A25 -> 121.95121951219514
A26: 10 | B26: 112 | C26: 103 | D26: =1000/A26 -> 100
A27: 12 | B27: 100 | C27: 92.5 | D27: =1000/A27 -> 83.333333333333329
A28: 15 | B28: 88 | C28: 82 | D28: =1000/A28 -> 66.666666666666671
A29: 18 | B29: 80 | C29: 74 | D29: =1000/A29 -> 55.555555555555557
A30: 22 | B30: 72 | C30: 67 | D30: =1000/A30 -> 45.454545454545453
A31: 27 | B31: 64 | C31: 60.5 | D31: =1000/A31 -> 37.037037037037038
A32: 33 | B32: 58 | C32: 55 | D32: =1000/A32 -> 30.303030303030305
A33: 39 | B33: 53 | C33: 50 | D33: =1000/A33 -> 25.641025641025642
A34: 47 | B34: 48 | C34: 46 | D34: =1000/A34 -> 21.276595744680851
A35: 56 | B35: 45 | C35: 42 | D35: =1000/A35 -> 17.857142857142858
A36: 68 | B36: 40 | C36: 38 | D36: =1000/A36 -> 14.705882352941176
A37: 82 | B37: 37 | C37: 35 | D37: =1000/A37 -> 12.195121951219512
A38: 100 | B38: 33 | C38: 32.5 | D38: =1000/A38 -> 10
A39: 120 | B39: 30 | C39: 29.6 | D39: =1000/A39 -> 8.3333333333333339
A40: 150 | B40: 26.5 | C40: 27 | D40: =1000/A40 -> 6.666666666666667
A41: 180 | B41: 25 | C41: 24.3 | D41: =1000/A41 -> 5.5555555555555554
A42: 220 | B42: 23 | C42: 22.5 | D42: =1000/A42 -> 4.5454545454545459
A43: 270 | B43: 21 | C43: 20.5 | D43: =1000/A43 -> 3.7037037037037037
A44: 330 | B44: 19.6 | C44: 19.3 | D44: =1000/A44 -> 3.0303030303030303
A45: 390 | B45: 18.3 | C45: 17.8 | D45: =1000/A45 -> 2.5641025641025643
A46: 470 | B46: 16.7 | C46: 16.4 | D46: =1000/A46 -> 2.1276595744680851
A47: 560 | B47: 15.4 | C47: 15.2 | D47: =1000/A47 -> 1.7857142857142858
A48: 680 | B48: 14.3 | C48: 14.08 | D48: =1000/A48 -> 1.4705882352941178
A49: 820 | B49: 12.8 | C49: 12.6 | D49: =1000/A49 -> 1.2195121951219512
A50: 1000 | B50: 12.4 | C50: 12.2 | D50: =1000/A50 -> 1